uniprot_name	uniprot_id	Orig_AA	Position	Mut_AA	type	info	comes_from
MK08	P45983	K	55	D	D	Abolished protein kinase activity."""";/evidence=""""ECO:0000269|PubMed:22966201""""	uniprot_sprot_dat_gz
MK11	Q15759	T	180	A	D	Inactivation."""";/evidence=""""ECO:0000269|PubMed:15356147""""	uniprot_sprot_dat_gz
MK11	Q15759	Y	182	F	D	Inactivation."""";/evidence=""""ECO:0000269|PubMed:15356147""""	uniprot_sprot_dat_gz
MK14	Q16539	A	34	V	D	Lowered kinase activity."""";/evidence=""""ECO:0000269|PubMed:7493921""""	uniprot_sprot_dat_gz
MK14	Q16539	Y	69	H	D	Lowered kinase activity."""";/evidence=""""ECO:0000269|PubMed:15284239""""	uniprot_sprot_dat_gz
MK15	Q8TD08	K	42	R	D	Loss of autophosphorylation and activity. Does;not increase dopamine transporter activity. Impairs kinase;activity. Does not rescue cilium assembly in MAPK15-;depleted cells."""";/evidence=""""ECO:0000269|PubMed:11875070,;ECO:0000269|PubMed:28842414, ECO:0000269|PubMed:29021280""""	uniprot_sprot_dat_gz
MK15	Q8TD08	R	59	Q	D	Does not increase dopamine transporter;activity. Impairs kinase activity."""";/evidence=""""ECO:0000269|PubMed:28842414""""	uniprot_sprot_dat_gz
MK15	Q8TD08	T	175	A	D	Loss of autophosphorylation and activity.;Still heavily phosphorylated at Tyr-177. Does not rescues;inhibition of O-glycosylation in MAPK15-depleted cells;;when associated with F-177."""";/evidence=""""ECO:0000269|PubMed:11875070,;ECO:0000269|PubMed:16336213, ECO:0000269|PubMed:24618899""""	uniprot_sprot_dat_gz
MK15	Q8TD08	Y	177	A	D	Loss of autophosphorylation and activity.;Heavily phosphorylated at Thr-175."""";/evidence=""""ECO:0000269|PubMed:11875070,;ECO:0000269|PubMed:16336213""""	uniprot_sprot_dat_gz
MP2K1	Q02750	K	97	A	D	Loss of catalytic activity. Strongly reduces;phosphorylation upon UV irradiation."""";/evidence=""""ECO:0000269|PubMed:20956560""""	uniprot_sprot_dat_gz
MP2K3	P46734	S	218	A	D	Inactivation."""";/evidence=""""ECO:0000269|PubMed:8622669""""	uniprot_sprot_dat_gz
MP2K3	P46734	T	222	A	D	Inactivation."""";/evidence=""""ECO:0000269|PubMed:8622669""""	uniprot_sprot_dat_gz
MP2K5	Q13163	K	195	M	D	Inactivation."""";/evidence=""""ECO:0000269|PubMed:7759517""""	uniprot_sprot_dat_gz
MP2K5	Q13163	S	311	A	D	Inactivation."""";/evidence=""""ECO:0000269|PubMed:7759517""""	uniprot_sprot_dat_gz
MP2K5	Q13163	T	315	A	D	Inactivation."""";/evidence=""""ECO:0000269|PubMed:7759517""""	uniprot_sprot_dat_gz
MP2K6	P52564	S	207	A	D	Inactivation.""""	uniprot_sprot_dat_gz
MP2K6	P52564	T	211	A	D	Inactivation.""""	uniprot_sprot_dat_gz
MRCKA	Q5VT25	S	234	A	D	Loss of autophosphorylation and kinase;activity."""";/evidence=""""ECO:0000269|PubMed:11283256""""	uniprot_sprot_dat_gz
MRCKA	Q5VT25	T	240	A	D	Loss of autophosphorylation and kinase;activity."""";/evidence=""""ECO:0000269|PubMed:11283256""""	uniprot_sprot_dat_gz
MUSK	O15146	G	584	C,	D	D: Mild decrease in kinase activity."""";/evidence=""""ECO:0000269|PubMed:25029443""""	uniprot_sprot_dat_gz
MYLK	Q15746	A	1491	S	D	(in AAT7; decreases kinase activity;;dbSNP:rs1576422965)"""";/evidence=""""ECO:0000269|PubMed:29544503"""";/id=""""VAR_083425""""	uniprot_sprot_dat_gz
NEK10	Q6ZWH5	K	548	R	D	Catalytically inactive. Impaired mucociliary;transport."""";/evidence=""""ECO:0000269|PubMed:20956560,;ECO:0000269|PubMed:31959991""""	uniprot_sprot_dat_gz
NEK2	P51955	T	175	A	D	Kinase activity decreased by two fold."""";/evidence=""""ECO:0000269|PubMed:17197699""""	uniprot_sprot_dat_gz
NEK6	Q9HC98	K	74	M	D	Loss of autophosphorylation and of kinase;activity and induction of apoptosis; when associated with;M-75."""";/evidence=""""ECO:0000269|PubMed:14563848,;ECO:0000269|PubMed:19001501""""	uniprot_sprot_dat_gz
NEK6	Q9HC98	K	75	M	D	Loss of autophosphorylation and of kinase;activity and induction of apoptosis; when associated with;M-74."""";/evidence=""""ECO:0000269|PubMed:14563848,;ECO:0000269|PubMed:19001501""""	uniprot_sprot_dat_gz
NIM1	Q8IY84	T	229	A	D	Loss of autophosphorylation and kinase;activity."""";/evidence=""""ECO:0000269|PubMed:15733851""""	uniprot_sprot_dat_gz
NUAK1	O60285	K	84	A	D	Abolishes kinase activity and ability to;induce senescence."""";/evidence=""""ECO:0000269|PubMed:19927127,;ECO:0000269|PubMed:21317932""""	uniprot_sprot_dat_gz
NUAK1	O60285	T	211	A	D	Prevents phosphorylation and activation by;STK11/LKB1 complex. Abolishes ability to induce;senescence."""";/evidence=""""ECO:0000269|PubMed:14976552,;ECO:0000269|PubMed:19927127, ECO:0000269|PubMed:21317932""""	uniprot_sprot_dat_gz
NUAK2	Q9H093	K	81	R	D	Loss of autophosphorylation, kinase activity;and of anti-apoptotic activity."""";/evidence=""""ECO:0000269|PubMed:15345718""""	uniprot_sprot_dat_gz
OXSR1	O95747	K	46	A	D	Loss of autophosphorylation and kinase;activity."""";/evidence=""""ECO:0000269|PubMed:14707132,;ECO:0000269|PubMed:16389068""""	uniprot_sprot_dat_gz
PAK1	Q13153	K	299	R	D	Strongly decreases activity. Abolishes kinase;activity; when associated with N-389."""";/evidence=""""ECO:0000269|PubMed:22153498""""	uniprot_sprot_dat_gz
PAK1	Q13153	D	389	N	D	Abolishes kinase activity; when associated;with R-299."""";/evidence=""""ECO:0000269|PubMed:22153498""""	uniprot_sprot_dat_gz
PAK1	Q13153	T	423	A	D	Decreases CDC42-stimulated activity and;autophosphorylation."""";/evidence=""""ECO:0000269|PubMed:10551809""""	uniprot_sprot_dat_gz
PAK1	Q13153	Y	429	C	D	(in IDDMSSD; gain-of-function; enhanced PAK1;kinase activity and significantly reduced homodimerization;;dbSNP:rs1565583382)"""";/evidence=""""ECO:0000269|PubMed:30290153"""";/id=""""VAR_081555""""	uniprot_sprot_dat_gz
PAK2	Q13177	K	278	R	D	Abolishes kinase activity and;autophosphorylation."""";/evidence=""""ECO:0000269|PubMed:9786869""""	uniprot_sprot_dat_gz
PAK2	Q13177	T	402	A	D	Abolishes kinase activity and greatly inhibits;autophosphorylation of PAK-2p27 and PAK-2p34."""";/evidence=""""ECO:0000269|PubMed:9786869""""	uniprot_sprot_dat_gz
PASK	Q96RG2	R	1058	A	D	Induces lower protein kinase activity."""";/evidence=""""ECO:0000269|PubMed:20943661""""	uniprot_sprot_dat_gz
PASK	Q96RG2	A	1151	K	D	Induces lower protein kinase activity and;ability to autophosphorylate."""";/evidence=""""ECO:0000269|PubMed:20943661""""	uniprot_sprot_dat_gz
PASK	Q96RG2	Y	1152	F	D	Induces lower protein kinase activity."""";/evidence=""""ECO:0000269|PubMed:20943661""""	uniprot_sprot_dat_gz
PIM1	P11309	L	193	F	D	Decreased kinase activity."""";/evidence=""""ECO:0000269|PubMed:15808862""""	uniprot_sprot_dat_gz
PINK1	Q9BXM7	D	362	A	D	Abolishes MFN2 phosphorylation and interaction;with PRKN; when associated with A-219 and A-384. Loss of;enzyme activity and impaired localization of PRKN to;mitochondria; when associated with M-219 and A-384."""";/evidence=""""ECO:0000269|PubMed:18957282,;ECO:0000269|PubMed:23620051, ECO:0000269|PubMed:32047033""""	uniprot_sprot_dat_gz
PINK1	Q9BXM7	D	384	A	D	Abolishes MFN2 phosphorylation and interaction;with PRKN; when associated with A-219 and A-362. Loss of;enzyme activity and impaired localization of PRKN to;mitochondria; when associated with M-219 and A-362."""";/evidence=""""ECO:0000269|PubMed:18957282,;ECO:0000269|PubMed:23620051, ECO:0000269|PubMed:32047033""""	uniprot_sprot_dat_gz
PINK1	Q9BXM7	G	386	A	D	(in PARK6; abolishes kinase activity)"""";/evidence=""""ECO:0000269|PubMed:16401616,;ECO:0000269|PubMed:24784582"""";/id=""""VAR_062776""""	uniprot_sprot_dat_gz
PKN1	Q16512	K	644	E	D	Abolishes Serine/threonine-protein kinase;activity."""";/evidence=""""ECO:0000269|PubMed:18066052,;ECO:0000269|PubMed:8135837""""	uniprot_sprot_dat_gz
PKN2	Q16513	T	816	A	D	Reduces catalytic activity."""";/evidence=""""ECO:0000269|PubMed:18835241""""	uniprot_sprot_dat_gz
PKN3	Q6P5Z2	K	588	E	D	Abolishes autophosphorylation and catalytic;activity."""";/evidence=""""ECO:0000269|PubMed:10441506,;ECO:0000269|PubMed:15282551""""	uniprot_sprot_dat_gz
PKN3	Q6P5Z2	K	588	R	D	Abolishes catalytic activity."""";/evidence=""""ECO:0000269|PubMed:10441506,;ECO:0000269|PubMed:15282551""""	uniprot_sprot_dat_gz
PLK1	P53350	D	176	N	D	Abolishes kinase activity."""";/evidence=""""ECO:0000269|PubMed:18615013""""	uniprot_sprot_dat_gz
PLK1	P53350	T	210	A	D	Abolishes activity. Abolishes checkpoint;recovery."""";/evidence=""""ECO:0000269|PubMed:12207013,;ECO:0000269|PubMed:12447691, ECO:0000269|PubMed:17461553,;ECO:0000269|PubMed:18615013, ECO:0000269|PubMed:19160488""""	uniprot_sprot_dat_gz
PLK3	Q9H4B4	K	91	R	D	Kinase defective mutant, abolishes activity."""";/evidence=""""ECO:0000269|PubMed:11447225,;ECO:0000269|PubMed:14980500, ECO:0000269|PubMed:17804415,;ECO:0000269|PubMed:19103756, ECO:0000269|PubMed:19490146,;ECO:0000269|PubMed:20889502, ECO:0000269|PubMed:20940307""""	uniprot_sprot_dat_gz
PLK3	Q9H4B4	D	203	A	D	Kinase defective mutant, abolishes activity."""";/evidence=""""ECO:0000269|PubMed:11156373""""	uniprot_sprot_dat_gz
PLK4	O00444	D	154	A	D	Catalytically inactive mutant that causes some;centrosome amplification above background levels when;overexpressed."""";/evidence=""""ECO:0000269|PubMed:16244668""""	uniprot_sprot_dat_gz
PTK6	Q13882	K	219	M	D	Abolishes kinase activity and cell;transformation, and phosphorylation of STAP2."""";/evidence=""""ECO:0000269|PubMed:10980601,;ECO:0000269|PubMed:15471878, ECO:0000269|PubMed:8940083""""	uniprot_sprot_dat_gz
PTK6	Q13882	K	219	R	D	Abolishes kinase activity."""";/evidence=""""ECO:0000269|PubMed:27480927""""	uniprot_sprot_dat_gz
PTK6	Q13882	Y	342	A	D	3-fold lower specific kinase activity.;Decreased, but still significant, autophosphorylation.;Decreased, but still significant, autophosphorylation; when;associated with A-447."""";/evidence=""""ECO:0000269|PubMed:12121988""""	uniprot_sprot_dat_gz
RAF1	P04049	K	375	W	D	Catalytically inactive."""";/evidence=""""ECO:0000269|PubMed:20956560""""	uniprot_sprot_dat_gz
RAF1	P04049	D	486	N	D	(in NS5; has reduced or absent kinase;activity; dbSNP:rs80338798)"""";/evidence=""""ECO:0000269|PubMed:17603483"""";/id=""""VAR_037817""""	uniprot_sprot_dat_gz
RAF1	P04049	T	491	I	D	(in NS5; has reduced or absent kinase;activity; dbSNP:rs80338799)"""";/evidence=""""ECO:0000269|PubMed:17603483"""";/id=""""VAR_037818""""	uniprot_sprot_dat_gz
RAF1	P04049	L	603	P	D	(in CMD1NN; shows impaired kinase activity;and reduced MAPK3 activation with this mutation;;dbSNP:rs587777586)"""";/evidence=""""ECO:0000269|PubMed:24777450"""";/id=""""VAR_071847""""	uniprot_sprot_dat_gz
RIPK1	Q13546	K	45	A	D	Abolishes kinase activity."""";/evidence=""""ECO:0000269|PubMed:30988283,;ECO:0000269|PubMed:8612133""""	uniprot_sprot_dat_gz
RIPK1	Q13546	S	161	A	D	Decreases RIPK1 kinase activity."""";/evidence=""""ECO:0000269|PubMed:18408713""""	uniprot_sprot_dat_gz
RIPK2	O43353	K	47	A	D	Abolishes kinase activity."""";/evidence=""""ECO:0000269|PubMed:9575181,;ECO:0000269|PubMed:9642260""""	uniprot_sprot_dat_gz
RIPK2	O43353	D	146	N	D	Abolishes kinase activity."""";/evidence=""""ECO:0000269|PubMed:9705938""""	uniprot_sprot_dat_gz
RIPK3	Q9Y572	K	50	D	D	Abolishes kinase activity."""";/evidence=""""ECO:0000269|PubMed:10339433,;ECO:0000269|PubMed:10358032, ECO:0000269|PubMed:22265414""""	uniprot_sprot_dat_gz
RIPK3	Q9Y572	D	142	N	D	Abolishes kinase activity and ability to;mediate necroptosis."""";/evidence=""""ECO:0000269|PubMed:22265413""""	uniprot_sprot_dat_gz
RIPK3	Q9Y572	T	182	A	D	Abolishes kinase activity. Loss of interaction;with PELI1 and PELI1-mediated ubiquitination. No loss of;interaction with STUB1 and STUB1-mediated ubiquitination.;No loss of interaction with RIPK1. Loss of ability to;mediate TNF-induced necroptosis. Loss of;autophosphorylation at Ser-227."""";/evidence=""""ECO:0000269|PubMed:29883609""""	uniprot_sprot_dat_gz
RIPK3	Q9Y572	S	227	A	D	Abolishes ability to mediate necroptosis.;Partial loss of kinase activity. No loss of PELI1-mediated;degradation."""";/evidence=""""ECO:0000269|PubMed:22265413,;ECO:0000269|PubMed:29883609""""	uniprot_sprot_dat_gz
RN5A	Q05823	R	462	Q	D	(risk factor for prostate cancer; reduced;enzymatic activity; dbSNP:rs486907)"""";/evidence=""""ECO:0000269|PubMed:11799394,;ECO:0000269|PubMed:11941539, ECO:0000269|PubMed:12415269,;ECO:0000269|PubMed:17344846"""";/id=""""VAR_012056""""	uniprot_sprot_dat_gz
ROR1	Q01973	R	736	T	D	(in DFNB108; impairs plasma membrane;location; abolishes downstream NFkB activation;;dbSNP:rs1553163562)"""";/evidence=""""ECO:0000269|PubMed:27162350"""";/id=""""VAR_079530""""	uniprot_sprot_dat_gz
SGK1	O00141	K	127	M	D	Abolishes enzymatic activity."""";/evidence=""""ECO:0000269|PubMed:11696533,;ECO:0000269|PubMed:12911626, ECO:0000269|PubMed:15040001""""	uniprot_sprot_dat_gz
SGK1	O00141	T	256	A	D	Low activity."""";/evidence=""""ECO:0000269|PubMed:10191262""""	uniprot_sprot_dat_gz
SGK1	O00141	T	256	D	D	Low activity."""";/evidence=""""ECO:0000269|PubMed:10191262""""	uniprot_sprot_dat_gz
SGK1	O00141	T	256	E	D	Low activity."""";/evidence=""""ECO:0000269|PubMed:10191262""""	uniprot_sprot_dat_gz
SGK3	Q96BR1	K	191	M	D	Abolishes activity."""";/evidence=""""ECO:0000269|PubMed:16790420""""	uniprot_sprot_dat_gz
SIK1	P57059	S	135	A	D	Decreased kinase activity without affecting;much autophosphorylation status."""";/evidence=""""ECO:0000269|PubMed:18348280""""	uniprot_sprot_dat_gz
SIK1	P57059	T	182	A	D	Prevents phosphorylation and activation by;STK11/LKB1 complex. Reduced inhibition of CRTC3-mediated;transcriptional activity."""";/evidence=""""ECO:0000269|PubMed:14976552,;ECO:0000269|PubMed:29211348""""	uniprot_sprot_dat_gz
SIK1	P57059	S	186	A,	D	D,C,G: Impaired autophosphorylation and kinase;activity."""";/evidence=""""ECO:0000269|PubMed:18348280""""	uniprot_sprot_dat_gz
SIK1	P57059	S	209	A	D	Decreased kinase activity without affecting;much autophosphorylation status."""";/evidence=""""ECO:0000269|PubMed:18348280""""	uniprot_sprot_dat_gz
SIK1	P57059	S	248	A	D	Decreased kinase activity without affecting;much autophosphorylation status."""";/evidence=""""ECO:0000269|PubMed:18348280""""	uniprot_sprot_dat_gz
SIK2	Q9H0K1	T	175	A	D	Prevents phosphorylation and activation by;STK11/LKB1 complex."""";/evidence=""""ECO:0000269|PubMed:14976552""""	uniprot_sprot_dat_gz
SIK3	Q9Y2K2	T	221	A	D	Prevents phosphorylation and activation by;STK11/LKB1 complex."""";/evidence=""""ECO:0000269|PubMed:14976552""""	uniprot_sprot_dat_gz
SNRK	Q9NRH2	T	173	A,	D	E: Prevents phosphorylation and activation by;STK11/LKB1 complex."""";/evidence=""""ECO:0000269|PubMed:15733851""""	uniprot_sprot_dat_gz
SRC	P12931	K	298	M	D	Kinase inactive. Abolishes ubiquitination;promoted by CBLC."""";/evidence=""""ECO:0000269|PubMed:14661060""""	uniprot_sprot_dat_gz
ST38L	Q9Y2H1	K	119	A	D	Loss of autophosphorylation and kinase;activity."""";/evidence=""""ECO:0000269|PubMed:15037617""""	uniprot_sprot_dat_gz
ST38L	Q9Y2H1	S	282	A	D	Loss of autophosphorylation and kinase;activity."""";/evidence=""""ECO:0000269|PubMed:15037617""""	uniprot_sprot_dat_gz
STK11	Q15831	L	67	P	D	(in PJS; abolishes kinase activity, leading;to loss of autophosphorylation; dbSNP:rs137853077)"""";/evidence=""""ECO:0000269|PubMed:9428765,;ECO:0000269|PubMed:9837816"""";/id=""""VAR_006202""""	uniprot_sprot_dat_gz
STK11	Q15831	K	78	I	D	Loss of kinase activity, leading to greatly;reduced autophosphorylation."""";/evidence=""""ECO:0000269|PubMed:11430832,;ECO:0000269|PubMed:9837816""""	uniprot_sprot_dat_gz
STK11	Q15831	K	78	M	D	Loss of kinase activity, leading to reduced;autophosphorylation and acting as a dominant-negative;mutant."""";/evidence=""""ECO:0000269|PubMed:11430832,;ECO:0000269|PubMed:9837816""""	uniprot_sprot_dat_gz
STK11	Q15831	G	163	D	D	(in TGCT; a tumor with seminoma and teratoma;components; associated with severely impaired but;detectable kinase activity; somatic mutation; impairs;heterotrimeric complex assembly with STRADA and CAB39;;predominantly nuclear localization; dbSNP:rs137853078)"""";/evidence=""""ECO:0000269|PubMed:19892943,;ECO:0000269|PubMed:9605748, ECO:0000269|PubMed:9887330"""";/id=""""VAR_033140""""	uniprot_sprot_dat_gz
STK11	Q15831	D	176	N	D	(in PJS; loss of kinase activity, leading to;greatly reduced autophosphorylation; fails to phosphorylate;PTEN in vitro; no significant effect on nucleocytoplasmic;localization; dbSNP:rs730881979)"""";/evidence=""""ECO:0000269|PubMed:15987703,;ECO:0000269|PubMed:9837816"""";/id=""""VAR_071058""""	uniprot_sprot_dat_gz
STK11	Q15831	E	199	K	D	(in colorectal cancer; somatic mutation;;impaired kinase activity; dbSNP:rs121913317)"""";/evidence=""""ECO:0000269|PubMed:9731485"""";/id=""""VAR_065641""""	uniprot_sprot_dat_gz
STK11	Q15831	W	308	C	D	(in PJS; abolishes kinase activity, leading;to loss of autophosphorylation; dbSNP:rs1057520042)"""";/evidence=""""ECO:0000269|PubMed:9837816"""";/id=""""VAR_071059""""	uniprot_sprot_dat_gz
STK26	Q9P289	K	53	E	D	Abolished serine/threonine-protein kinase;activity."""";/evidence=""""ECO:0000269|PubMed:29232556""""	uniprot_sprot_dat_gz
STK38	Q15208	K	118	A	D	Loss of autophosphorylation and kinase;activity."""";/evidence=""""ECO:0000269|PubMed:12493777,;ECO:0000269|PubMed:7761441""""	uniprot_sprot_dat_gz
STK38	Q15208	S	281	A	D	Loss of autophosphorylation and kinase;activity."""";/evidence=""""ECO:0000269|PubMed:12493777""""	uniprot_sprot_dat_gz
STRAA	Q7RTN6	Y	185	F	D	Suppresses STK11/LKB1 activation without;affecting complex assembly."""";/evidence=""""ECO:0000269|PubMed:19892943""""	uniprot_sprot_dat_gz
TAOK1	Q7L7X3	K	57	A	D	Abolishes kinase activity, ability to activate;the MAPK8/JNK cascade and cleavage by caspase-3 (CASP3)."""";/evidence=""""ECO:0000269|PubMed:16407310""""	uniprot_sprot_dat_gz
TBK1	Q9UHD2	K	30	R	D	Decreases ubiquitination. Abolishes;ubiquitination, phosphorylation and kinase activity; when;associated with R-401."""";/evidence=""""ECO:0000269|PubMed:23453971""""	uniprot_sprot_dat_gz
TBK1	Q9UHD2	D	33	A	D	Decreases phosphorylation and kinase;activity."""";/evidence=""""ECO:0000269|PubMed:23453971""""	uniprot_sprot_dat_gz
TBK1	Q9UHD2	S	172	E	D	Decreased kinase activity."""";/evidence=""""ECO:0000269|PubMed:11839743,;ECO:0000269|PubMed:23453972""""	uniprot_sprot_dat_gz
TGFR2	P37173	K	277	R	D	Abolishes kinase activity, TGF-beta signaling;and interaction with DAXX."""";/evidence=""""ECO:0000269|PubMed:11483955""""	uniprot_sprot_dat_gz
TITIN	Q8WZ42	K	32207	A	D	Disrupts catalytic activity."""";/evidence=""""ECO:0000269|PubMed:9804419""""	uniprot_sprot_dat_gz
TLK2	Q86UE8	H	493	R	D	(in MRD57; reduced kinase activity;;dbSNP:rs1567974030)"""";/evidence=""""ECO:0000269|PubMed:29861108,;ECO:0000269|PubMed:29955062"""";/id=""""VAR_081028""""	uniprot_sprot_dat_gz
TLK2	Q86UE8	H	518	N	D	Reduced kinase activity."""";/evidence=""""ECO:0000269|PubMed:29955062""""	uniprot_sprot_dat_gz
TLK2	Q86UE8	H	518	R	D	(in MRD57; severely reduced kinase activity;;dbSNP:rs1567995650)"""";/evidence=""""ECO:0000269|PubMed:29861108,;ECO:0000269|PubMed:29955062"""";/id=""""VAR_081029""""	uniprot_sprot_dat_gz
TLK2	Q86UE8	S	617	L	D	(in MRD57; exhibits abnormal perinuclear;localization instead of diffuse nuclear localization;;impairs kinase activity; reduced phosphorylation of ASF1A)"""";/evidence=""""ECO:0000269|PubMed:21572417,;ECO:0000269|PubMed:33323470"""";/id=""""VAR_087042""""	uniprot_sprot_dat_gz
TLK2	Q86UE8	S	659	A	D	Reduced kinase activity."""";/evidence=""""ECO:0000269|PubMed:29955062""""	uniprot_sprot_dat_gz
TLK2	Q86UE8	S	686	A	D	Reduced kinase activity."""";/evidence=""""ECO:0000269|PubMed:29955062""""	uniprot_sprot_dat_gz
TLK2	Q86UE8	S	686	D	D	Reduced kinase activity."""";/evidence=""""ECO:0000269|PubMed:29955062""""	uniprot_sprot_dat_gz
TLK2	Q86UE8	T	695	A	D	Reduced kinase activity."""";/evidence=""""ECO:0000269|PubMed:29955062""""	uniprot_sprot_dat_gz
TNI3K	Q59H18	K	490	R	D	Loss of autophosphorylation activity."""";/evidence=""""ECO:0000269|PubMed:12721663""""	uniprot_sprot_dat_gz
TRIO	O75962	K	2917	A	D	Expected to disrupt kinase activity. Causes;reorganization of the actin cytoskeleton in the absence of;NGF."""";/evidence=""""ECO:0000269|PubMed:22155786""""	uniprot_sprot_dat_gz
TTBK2	Q6IQ55	K	50	E,	D	A: Leads to inactivation/destabilization of the;protein."""";/evidence=""""ECO:0000269|PubMed:21548880""""	uniprot_sprot_dat_gz
TTBK2	Q6IQ55	K	143	E,	D	A: Leads to inactivation/destabilization of the;protein."""";/evidence=""""ECO:0000269|PubMed:21548880""""	uniprot_sprot_dat_gz
TTBK2	Q6IQ55	D	163	A	D	Abolishes serine/threonine-protein kinase;activity."""";/evidence=""""ECO:0000269|PubMed:21548880""""	uniprot_sprot_dat_gz
TTBK2	Q6IQ55	A	184	E,	D	G: Impaired serine/threonine-protein kinase;activity."""";/evidence=""""ECO:0000269|PubMed:21548880""""	uniprot_sprot_dat_gz
TXK	P42681	K	299	A	D	Impairs kinase activity."""";/evidence=""""ECO:0000269|PubMed:9813138""""	uniprot_sprot_dat_gz
UFO	P30530	K	567	M	D	Catalytically inactive mutant."""";/evidence=""""ECO:0000269|PubMed:28076778""""	uniprot_sprot_dat_gz
ULK1	O75385	K	46	I	D	Abolished serine/threonine-protein kinase;activity."""";/evidence=""""ECO:0000269|PubMed:20921139,;ECO:0000269|PubMed:28821708""""	uniprot_sprot_dat_gz
ULK2	Q8IYT8	K	39	R	D	Decreased kinase activity and decreased;autophosphorylation."""";/evidence=""""ECO:0000269|PubMed:18936157""""	uniprot_sprot_dat_gz
ULK3	Q6PHR2	K	44	R	D	Decreased kinase activity."""";/evidence=""""ECO:0000269|PubMed:19878745""""	uniprot_sprot_dat_gz
VGFR1	P17948	K	861	M	D	Abolishes enzyme activity. Abolishes;interaction with PLCG."""";/evidence=""""ECO:0000269|PubMed:9299537""""	uniprot_sprot_dat_gz
VGFR2	P35968	V	848	E	D	(strongly reduced autophosphorylation and;kinase activity; dbSNP:rs1139776)"""";/evidence=""""ECO:0000269|PubMed:10037737,;ECO:0000269|PubMed:1656371"""";/id=""""VAR_046679""""	uniprot_sprot_dat_gz
VGFR3	P35916	K	879	G	D	Abolishes enzyme activity."""";/evidence=""""ECO:0000269|PubMed:12881528""""	uniprot_sprot_dat_gz
WEE1	P30291	K	328	R	D	Abolishes activity."""";/evidence=""""ECO:0000269|PubMed:8428596""""	uniprot_sprot_dat_gz
WNK3	Q9BYP7	D	294	A	D	Catalytically inactive form. Inhibits sodium-;coupled chloride cotransporters and activates potassium-;coupled chloride cotransporters."""";/evidence=""""ECO:0000269|PubMed:16275913,;ECO:0000269|PubMed:21613606""""	uniprot_sprot_dat_gz
ZAP70	P43403	D	461	N	D	Abolishes kinase activity."""";/evidence=""""ECO:0000269|PubMed:17512407""""	uniprot_sprot_dat_gz
ZAP70	P43403	D	479	N	D	Abolishes kinase activity."""";/evidence=""""ECO:0000269|PubMed:15292186""""	uniprot_sprot_dat_gz
