uniprot_name	uniprot_id	Orig_AA	Position	Mut_AA	type	info	comes_from
ABL1	P00519	A	337	T	A	(in CHDSKM; increases kinase activity; no;effect on protein levels; dbSNP:rs1060499548)"""";/evidence=""""ECO:0000269|PubMed:28288113"""";/id=""""VAR_079483""""	uniprot_sprot_dat_gz
AKT1	P31749	T	308	D	A	5-fold activation and 18-fold activation; when;associated with D-473."""";/evidence=""""ECO:0000269|PubMed:12244301,;ECO:0000269|PubMed:8978681""""	uniprot_sprot_dat_gz
AKT2	P31751	T	309	E	A	Constitutively active; when associated with D-;474."""";/evidence=""""ECO:0000269|PubMed:15890450,;ECO:0000269|PubMed:20059950""""	uniprot_sprot_dat_gz
ALK	Q9UM73	F	1174	L	A	(in NBLST3; somatic mutation; constitutively;activated; retained in the endoplasmic reticulum and Golgi;compartments; dbSNP:rs863225281)"""";/evidence=""""ECO:0000269|PubMed:18923523,;ECO:0000269|PubMed:18923525, ECO:0000269|PubMed:21242967"""";/id=""""VAR_063857""""	uniprot_sprot_dat_gz
ALK	Q9UM73	F	1174	V	A	(in NBLST3; somatic mutation; constitutively;activated; retained in the endoplasmic reticulum and Golgi;compartments; dbSNP:rs281864719)"""";/evidence=""""ECO:0000269|PubMed:18923523,;ECO:0000269|PubMed:21242967"""";/id=""""VAR_063858""""	uniprot_sprot_dat_gz
ALK	Q9UM73	R	1275	Q	A	(in NBLST3; constitutively activated;;retained in the endoplasmic reticulum and Golgi;compartments; dbSNP:rs113994087)"""";/evidence=""""ECO:0000269|PubMed:18724359,;ECO:0000269|PubMed:18923523, ECO:0000269|PubMed:18923525,;ECO:0000269|PubMed:21242967, ECO:0000269|PubMed:22932897"""";/id=""""VAR_063865""""	uniprot_sprot_dat_gz
ANPRB	P20594	R	655	C	A	(in ECDM; the mutation results in increased;guanylate cyclase activity; dbSNP:rs587777596)"""";/evidence=""""ECO:0000269|PubMed:24057292"""";/id=""""VAR_071876""""	uniprot_sprot_dat_gz
AURKA	O14965	V	174	M	A	(in a metastatic melanoma sample; somatic;mutation; constitutively enhanced kinase activity)"""";/evidence=""""ECO:0000269|PubMed:17344846,;ECO:0000269|PubMed:19801554"""";/id=""""VAR_041129""""	uniprot_sprot_dat_gz
AURKA	O14965	T	288	D	A	Mimics phosphorylation state and increases;kinase activity."""";/evidence=""""ECO:0000269|PubMed:11039908""""	uniprot_sprot_dat_gz
BRAF	P15056	G	464	V	A	(in a colorectal cancer cell line; elevated;kinase activity; efficiently induces cell transformation;;dbSNP:rs121913348)"""";/evidence=""""ECO:0000269|PubMed:12068308"""";/id=""""VAR_018616""""	uniprot_sprot_dat_gz
BRAF	P15056	G	469	A	A	(in NHL; also in a lung adenocarcinoma;sample; somatic mutation; elevated kinase activity;;efficiently induces cell transformation;;dbSNP:rs121913355)"""";/evidence=""""ECO:0000269|PubMed:12068308,;ECO:0000269|PubMed:14612909, ECO:0000269|PubMed:17344846"""";/id=""""VAR_018620""""	uniprot_sprot_dat_gz
BRAF	P15056	L	597	V	A	(in NS7; also in a lung adenocarcinoma;sample; somatic mutation; elevated kinase activity;;efficiently induces cell transformation;;dbSNP:rs121913369)"""";/evidence=""""ECO:0000269|PubMed:12068308,;ECO:0000269|PubMed:17344846, ECO:0000269|PubMed:19206169"""";/id=""""VAR_018627""""	uniprot_sprot_dat_gz
BRAF	P15056	R	671	K	A	Increased kinase activity and stability in;response to EGF treatment."""";/evidence=""""ECO:0000269|PubMed:21917714""""	uniprot_sprot_dat_gz
BRSK2	Q8IWQ3	T	174	E	A	Constitutively activated."""";/evidence=""""ECO:0000269|PubMed:14976552,;ECO:0000269|PubMed:18339622, ECO:0000269|PubMed:22798068""""	uniprot_sprot_dat_gz
CDK19	Q9BWU1	Y	32	H	A	(in DEE87; fails to rescue neurologic;phenotypes in a Drosophila model system; increased protein;kinase activity; dbSNP:rs1236246272)"""";/evidence=""""ECO:0000269|PubMed:32330417,;ECO:0000269|PubMed:33134521, ECO:0000269|PubMed:33495529"""";/id=""""VAR_084395""""	uniprot_sprot_dat_gz
CDK2	P24941	T	14	A	A	2-fold increase in activity."""";/evidence=""""ECO:0000269|PubMed:1396589""""	uniprot_sprot_dat_gz
CDK2	P24941	Y	15	F	A	2-fold increase in activity."""";/evidence=""""ECO:0000269|PubMed:1396589""""	uniprot_sprot_dat_gz
CDK7	P50613	S	164	A	A	No mitotic repression of transcriptional;activity of the reconstituted TFIIH complex."""";/evidence=""""ECO:0000269|PubMed:9832506""""	uniprot_sprot_dat_gz
CDK9	P50750	K	48	R	A	Decreased acetylation; leading to enhanced;protein kinase activity."""";/evidence=""""ECO:0000269|PubMed:28426094""""	uniprot_sprot_dat_gz
CDK9	P50750	S	175	A	A	Constitutive kinase activity."""";/evidence=""""ECO:0000269|PubMed:21533037""""	uniprot_sprot_dat_gz
CDK9	P50750	T	186	D	A	Mimics autophosphorylation; constitutive;kinase activity, independently of calcium signaling."""";/evidence=""""ECO:0000269|PubMed:11145967,;ECO:0000269|PubMed:18566585, ECO:0000269|PubMed:21448926""""	uniprot_sprot_dat_gz
EGFR	P00533	G	719	S	A	(found in a lung cancer sample; somatic;mutation; strongly increased kinase activity;;constitutively activated kinase with higher levels of basal;autophosphorylation; more sensitive to gefitinib than wild-;type; dbSNP:rs28929495)"""";/evidence=""""ECO:0000269|PubMed:15118125,;ECO:0000269|PubMed:15623594, ECO:0000269|PubMed:16205628,;ECO:0000269|PubMed:16533793, ECO:0000269|PubMed:17349580"""";/id=""""VAR_019297""""	uniprot_sprot_dat_gz
EGFR	P00533	S	768	I	A	(found in a lung cancer sample;;constitutively activated kinase with higher levels of basal;autophosphorylation; more sensitive to gefitinib than wild-;type; dbSNP:rs121913465)"""";/evidence=""""ECO:0000269|PubMed:15623594,;ECO:0000269|PubMed:16205628"""";/id=""""VAR_069502""""	uniprot_sprot_dat_gz
EGFR	P00533	T	790	M	A	(found in a lung cancer sample; increased;kinase activity; dbSNP:rs121434569)"""";/evidence=""""ECO:0000269|PubMed:16533793,;ECO:0000269|PubMed:18227510"""";/id=""""VAR_026098""""	uniprot_sprot_dat_gz
EGFR	P00533	L	858	R	A	(found in a lung cancer sample; somatic;mutation; constitutively activated enzyme with strongly;increased kinase activity; more sensitive to gefitinib than;wild-type; dbSNP:rs121434568)"""";/evidence=""""ECO:0000269|PubMed:15118125,;ECO:0000269|PubMed:15623594, ECO:0000269|PubMed:16205628,;ECO:0000269|PubMed:16533793, ECO:0000269|PubMed:17349580"""";/id=""""VAR_019298""""	uniprot_sprot_dat_gz
EGFR	P00533	L	861	Q	A	(found in a lung cancer sample;;constitutively activated kinase with higher levels of basal;autophosphorylation; more sensitive to gefitinib than wild-;type; dbSNP:rs121913444)"""";/evidence=""""ECO:0000269|PubMed:15623594,;ECO:0000269|PubMed:16205628, ECO:0000269|PubMed:16533793"""";/id=""""VAR_026102""""	uniprot_sprot_dat_gz
EPHA2	P29317	R	721	Q	A	(in CTRCT6; retained in the cytoplasm and;constitutively active it alters EPHA2 signaling;;dbSNP:rs116506614)"""";/evidence=""""ECO:0000269|PubMed:19649315"""";/id=""""VAR_062532""""	uniprot_sprot_dat_gz
EPHA3	P29320	Y	742	F	A	Full kinase activity; when associated with F-;596 and F-602."""";/evidence=""""ECO:0000269|PubMed:18547520""""	uniprot_sprot_dat_gz
EPHA3	P29320	S	768	A	A	Full kinase activity; when associated with F-;596 and F-602."""";/evidence=""""ECO:0000269|PubMed:18547520""""	uniprot_sprot_dat_gz
FES	P07332	R	706	Q	A	Negligible effect on autophosphorylation and;kinase activity."""";/evidence=""""ECO:0000269|PubMed:15867340,;ECO:0000269|PubMed:16455651""""	uniprot_sprot_dat_gz
FGFR2	P21802	K	526	E	A	(in FSPC; constitutive kinase activity;;dbSNP:rs121918507)"""";/evidence=""""ECO:0000269|PubMed:16061565,;ECO:0000269|PubMed:17803937"""";/id=""""VAR_023788""""	uniprot_sprot_dat_gz
FGFR2	P21802	N	549	T	A	Constitutive kinase activity."""";/evidence=""""ECO:0000269|PubMed:17803937""""	uniprot_sprot_dat_gz
FGFR2	P21802	N	549	H	A	(in CS; constitutive kinase activity;;dbSNP:rs1057519045)"""";/evidence=""""ECO:0000269|PubMed:11781872,;ECO:0000269|PubMed:17803937"""";/id=""""VAR_017276""""	uniprot_sprot_dat_gz
FGFR2	P21802	E	565	A	A	Constitutive kinase activity."""";/evidence=""""ECO:0000269|PubMed:17803937""""	uniprot_sprot_dat_gz
FGFR2	P21802	E	565	G	A	(in PS; constitutive kinase activity;;dbSNP:rs121918506)"""";/evidence=""""ECO:0000269|PubMed:11781872,;ECO:0000269|PubMed:17803937"""";/id=""""VAR_017277""""	uniprot_sprot_dat_gz
FGFR2	P21802	K	641	R	A	(in PS; constitutive kinase activity;;dbSNP:rs1057519047)"""";/evidence=""""ECO:0000269|PubMed:11781872,;ECO:0000269|PubMed:17803937"""";/id=""""VAR_017278""""	uniprot_sprot_dat_gz
FLT3	P36888	D	835	E	A	(in acute lymphoblastic leukemia patients and;acute myelogenous leukemia patients; somatic mutation;;constitutively activated; dbSNP:rs121913487)"""";/evidence=""""ECO:0000269|PubMed:11290608,;ECO:0000269|PubMed:14504097"""";/id=""""VAR_065679""""	uniprot_sprot_dat_gz
FLT3	P36888	D	835	H	A	(in acute lymphoblastic leukemia patients and;in acute myelogenous leukemia patients; somatic mutation;;constitutively activated; dbSNP:rs121913488)"""";/evidence=""""ECO:0000269|PubMed:11290608,;ECO:0000269|PubMed:11442493, ECO:0000269|PubMed:14504097"""";/id=""""VAR_065680""""	uniprot_sprot_dat_gz
FLT3	P36888	D	835	N	A	(in acute lymphoblastic leukemia patients and;in acute myelogenous leukemia patients; somatic mutation;;constitutively activated; dbSNP:rs121913488)"""";/evidence=""""ECO:0000269|PubMed:11290608"""";/id=""""VAR_065681""""	uniprot_sprot_dat_gz
FLT3	P36888	D	835	V	A	(in acute lymphoblastic leukemia patients and;in acute myelogenous leukemia patients; somatic mutation;;constitutively activated; dbSNP:rs121909646)"""";/evidence=""""ECO:0000269|PubMed:11290608"""";/id=""""VAR_065682""""	uniprot_sprot_dat_gz
FLT3	P36888	D	835	Y	A	(in acute lymphoblastic leukemia patients and;in acute myelogenous leukemia patients; somatic mutation;;constitutively activated; dbSNP:rs121913488)"""";/evidence=""""ECO:0000269|PubMed:11290608,;ECO:0000269|PubMed:11442493, ECO:0000269|PubMed:14504097"""";/id=""""VAR_065683""""	uniprot_sprot_dat_gz
GWL	Q96GX5	K	72	M	A	Hyperactive form."""";/evidence=""""ECO:0000269|PubMed:21164014""""	uniprot_sprot_dat_gz
IKKA	O15111	S	176	E	A	Full activation."""";/evidence=""""ECO:0000269|PubMed:9346484,;ECO:0000269|PubMed:9520446""""	uniprot_sprot_dat_gz
IKKB	O14920	K	171	E	A	Increased activation of NF-kappa-B signaling."""";/evidence=""""ECO:0000269|PubMed:30337470""""	uniprot_sprot_dat_gz
IKKB	O14920	S	177	E	A	Full activation. Interaction with TRIM21 is;enhanced; when associated with E-181. Monoubiquitinated;;when associated with R-163 and E-181. Strongly promoted NF-;kappa-B gene expression; when associated with E-181."""";/evidence=""""ECO:0000269|PubMed:19675099,;ECO:0000269|PubMed:9346484""""	uniprot_sprot_dat_gz
IKKB	O14920	S	181	E	A	Full activation. Interaction with TRIM21 is;enhanced; when associated with E-177. Monoubiquitinated;;when associated with R-163 and E-177. Strongly promoted NF-;kappa-B gene expression; when associated with E-177."""";/evidence=""""ECO:0000269|PubMed:19675099,;ECO:0000269|PubMed:9346484""""	uniprot_sprot_dat_gz
IKKB	O14920	V	203	I	A	(in IMD15A; gain-of-function mutation;resulting in increased activation of NF-kappa-B signaling;pathway; dbSNP:rs1563340753)"""";/evidence=""""ECO:0000269|PubMed:30337470"""";/id=""""VAR_081275""""	uniprot_sprot_dat_gz
INSR	P06213	R	1201	Q	A	(in HHF5 and IRAN type A; interferes with;kinase activation by insulin; dbSNP:rs121913156)"""";/evidence=""""ECO:0000269|PubMed:15161766,;ECO:0000269|PubMed:8082780, ECO:0000269|PubMed:8288049"""";/id=""""VAR_015929""""	uniprot_sprot_dat_gz
JAK1	P23458	V	658	F	A	Constitutively active. Increased receptor;signaling pathway via JAK-STAT."""";/evidence=""""ECO:0000269|PubMed:16239216""""	uniprot_sprot_dat_gz
JAK1	P23458	S	703	I	A	(in AIIDE; increased activation of protein;kinase activity; constitutive gain of function through the;transactivation of associated JAK kinases; increased;receptor signaling pathway via JAK-STAT)"""";/evidence=""""ECO:0000269|PubMed:32750333"""";/id=""""VAR_084992""""	uniprot_sprot_dat_gz
JAK2	O60674	V	617	F	A	(in PV, THCYT3 and AML; associated with;susceptibility to Budd-Chiari syndrome; somatic mutation in;a high percentage of patients with essential;thrombocythemia or myelofibrosis; leads to constitutive;tyrosine phosphorylation activity that promotes cytokine;hypersensitivity; dbSNP:rs77375493)"""";/evidence=""""ECO:0000269|PubMed:15781101,;ECO:0000269|PubMed:15793561, ECO:0000269|PubMed:15858187,;ECO:0000269|PubMed:16247455, ECO:0000269|PubMed:16325696,;ECO:0000269|PubMed:16603627"""";/id=""""VAR_032697""""	uniprot_sprot_dat_gz
KAPCA	P17612	K	48	R	A	Enhanced basal kinase activity; when;associated with Q-96, L-121, A-124, K-182 and A-184."""";/evidence=""""ECO:0000269|PubMed:21774789""""	uniprot_sprot_dat_gz
KAPCA	P17612	L	96	Q	A	Enhanced basal kinase activity; when;associated with R-48, L-121, A-124, K-182 and A-184."""";/evidence=""""ECO:0000269|PubMed:21774789""""	uniprot_sprot_dat_gz
KAPCA	P17612	M	121	L	A	Enhanced basal kinase activity; when;associated with R-48, Q-96, A-124, K-182 and A-184."""";/evidence=""""ECO:0000269|PubMed:21774789""""	uniprot_sprot_dat_gz
KAPCA	P17612	V	124	A	A	Enhanced basal kinase activity; when;associated with R-48, Q-96, L-121, K-182 and A-184."""";/evidence=""""ECO:0000269|PubMed:21774789""""	uniprot_sprot_dat_gz
KAPCA	P17612	Q	182	K	A	Enhanced basal kinase activity; when;associated with R-48, Q-96, L-121, A-124 and A-184."""";/evidence=""""ECO:0000269|PubMed:21774789""""	uniprot_sprot_dat_gz
KAPCA	P17612	T	184	A	A	Enhanced basal kinase activity; when;associated with R-48, Q-96, L-121, A-124 and K-182."""";/evidence=""""ECO:0000269|PubMed:21774789""""	uniprot_sprot_dat_gz
KAPCA	P17612	L	206	R	A	(in PPNAD4; somatic mutation; the mutation;results in cAMP-independent basal protein kinase activity;and constitutive activation of protein kinase A;;dbSNP:rs386352352)"""";/evidence=""""ECO:0000269|PubMed:24571724,;ECO:0000269|PubMed:24700472, ECO:0000269|PubMed:24747643,;ECO:0000269|PubMed:24855271"""";/id=""""VAR_071707""""	uniprot_sprot_dat_gz
KIT	P10721	D	816	F	A	(in MASTC; sporadic case; somatic mutation;;requires 2 nucleotide substitutions; constitutively;activated and is much more rapidly autophosphorylated than;wild type)"""";/evidence=""""ECO:0000269|PubMed:9990072"""";/id=""""VAR_033133""""	uniprot_sprot_dat_gz
KIT	P10721	D	816	H	A	(in a testicular tumor; seminoma; somatic;mutation; constitutively activated; dbSNP:rs121913506)"""";/evidence=""""ECO:0000269|PubMed:10362788,;ECO:0000269|PubMed:19164557, ECO:0000269|PubMed:20147452"""";/id=""""VAR_033134""""	uniprot_sprot_dat_gz
KIT	P10721	D	816	I	A	(in MASTC; somatic mutation; constitutively;activated; requires 2 nucleotide substitutions;;dbSNP:rs1057519709)"""";/evidence=""""ECO:0000269|PubMed:19865100"""";/id=""""VAR_081064""""	uniprot_sprot_dat_gz
KIT	P10721	D	816	Y	A	(in MASTSYS and MASTC; also found in acute;myeloid leukemia and a germ cell tumor of the testis;;somatic mutation; constitutively activated;;dbSNP:rs121913506)"""";/evidence=""""ECO:0000269|PubMed:16175573,;ECO:0000269|PubMed:17344846, ECO:0000269|PubMed:19865100,;ECO:0000269|PubMed:9657776, ECO:0000269|PubMed:9990072"""";/id=""""VAR_023828""""	uniprot_sprot_dat_gz
KIT	P10721	N	822	I	A	(in MASTC; constitutively activated;;dbSNP:rs993022333)"""";/evidence=""""ECO:0000269|PubMed:21689725"""";/id=""""VAR_081065""""	uniprot_sprot_dat_gz
KPCD2	Q9BZL6	S	706	E	A	Constitutive kinase activity; when associated;with E-710 or with E-244 and E-710. Increases Tyr-717;phosphorylation; when associated with E-710 or with E-710;and D-438."""";/evidence=""""ECO:0000269|PubMed:23503467,;ECO:0000269|PubMed:28428613""""	uniprot_sprot_dat_gz
KPCD2	Q9BZL6	S	710	E	A	Constitutive kinase activity; when associated;with E-706 or with E-244 and E-706. when associated with E-;710 or with E-244 and E-710. Increases Tyr-717;phosphorylation; when associated with E-710 or with E-710;and D-438."""";/evidence=""""ECO:0000269|PubMed:23503467,;ECO:0000269|PubMed:28428613""""	uniprot_sprot_dat_gz
KPCD2	Q9BZL6	Y	717	F	A	Abolishes phosphorylation. Decreases substrate;affinity and increases catalytic efficiency. Increases Ser-;706 or/and Ser-710 phosphorylation. Increases NF-kappa-B;activation in response to oxidative stress."""";/evidence=""""ECO:0000269|PubMed:28428613""""	uniprot_sprot_dat_gz
KPCL	P24723	V	374	I	A	(associated with susceptibility to ischemic;stroke; increases autophosphorylation and kinase activity;;dbSNP:rs2230500)"""";/evidence=""""ECO:0000269|PubMed:17206144,;ECO:0000269|PubMed:17344846"""";/id=""""VAR_034604""""	uniprot_sprot_dat_gz
KSYK	P43405	M	450	I	A	(in IMD82; constitutively active protein;tyrosine kinase activity)"""";/evidence=""""ECO:0000269|PubMed:33782605"""";/id=""""VAR_085997""""	uniprot_sprot_dat_gz
KSYK	P43405	S	550	F	A	(in IMD82; constitutively active protein;tyrosine kinase activity)"""";/evidence=""""ECO:0000269|PubMed:33782605"""";/id=""""VAR_085998""""	uniprot_sprot_dat_gz
KSYK	P43405	S	550	Y	A	(in IMD82; constitutively active protein;tyrosine kinase activity)"""";/evidence=""""ECO:0000269|PubMed:33782605"""";/id=""""VAR_085999""""	uniprot_sprot_dat_gz
LIMK1	P53667	T	508	E	A	Phosphomimetic mutant; enhances kinase;activity."""";/evidence=""""ECO:0000269|PubMed:22328514""""	uniprot_sprot_dat_gz
LIMK1	P53667	T	508	EE	A	: Enhances kinase activity."""";/evidence=""""ECO:0000269|PubMed:10196227,;ECO:0000269|PubMed:10652353""""	uniprot_sprot_dat_gz
LIMK2	P53671	T	505	E	A	Phosphomimetic mutant; enhances kinase;activity."""";/evidence=""""ECO:0000269|PubMed:11018042,;ECO:0000269|PubMed:22328514""""	uniprot_sprot_dat_gz
LRRK2	Q5S007	I	2020	T	A	(in PARK8; significant increase in;autophosphorylation of about 40% in comparison to wild-type;protein in vitro; shows a progressive reduction in neurite;length and branching; shows an increase in activity in;phosphorylation of RAB8A and RAB10; dbSNP:rs35870237)"""";/evidence=""""ECO:0000269|PubMed:15541309,;ECO:0000269|PubMed:15880653, ECO:0000269|PubMed:16172858,;ECO:0000269|PubMed:16251215, ECO:0000269|PubMed:16321986,;ECO:0000269|PubMed:17114044, ECO:0000269|PubMed:26824392,;ECO:0000269|PubMed:29212815"""";/id=""""VAR_024959""""	uniprot_sprot_dat_gz
LRRK2	Q5S007	T	2031	S	A	(in PARK8; shows an increase in activity in;phosphorylation of RAB8A and RAB10; dbSNP:rs78029637)"""";/evidence=""""ECO:0000269|PubMed:26824392,;ECO:0000269|PubMed:29212815"""";/id=""""VAR_082047""""	uniprot_sprot_dat_gz
MAPK2	P49137	T	222	D	A	Mimicks phosphorylation state, leading to;slight increase of basal kinase activity."""";/evidence=""""ECO:0000269|PubMed:14517288,;ECO:0000269|PubMed:15014438, ECO:0000269|PubMed:8846784""""	uniprot_sprot_dat_gz
MAPK2	P49137	T	222	E	A	Mimicks phosphorylation state and constitutive;protein kinase activity; when associated with E-334."""";/evidence=""""ECO:0000269|PubMed:14517288,;ECO:0000269|PubMed:15014438, ECO:0000269|PubMed:8846784""""	uniprot_sprot_dat_gz
MAPK2	P49137	S	272	D	A	Mimicks phosphorylation state, leading to;slight increase of basal kinase activity."""";/evidence=""""ECO:0000269|PubMed:8846784""""	uniprot_sprot_dat_gz
MAPK5	Q8IW41	T	182	D	A	Mimicks phosphorylation state and induces;constitutive protein kinase activity."""";/evidence=""""ECO:0000269|PubMed:12808055,;ECO:0000269|PubMed:21329882, ECO:0000269|PubMed:9628874""""	uniprot_sprot_dat_gz
MARK1	Q9P0L2	T	215	E	A	Constitutively active."""";/evidence=""""ECO:0000269|PubMed:14976552""""	uniprot_sprot_dat_gz
MELK	Q14680	T	167	D,	A	E: Phosphomimetic mutant that has similar;kinase activity as wild-type."""";/evidence=""""ECO:0000269|PubMed:14976552""""	uniprot_sprot_dat_gz
MK12	P53778	D	179	A	A	Emulation of the active state."""";/evidence=""""ECO:0000269|PubMed:15284239""""	uniprot_sprot_dat_gz
MK14	Q16539	D	176	A	A	Emulation of the active state. Increase in;activity; when associated with S-327 or L-327."""";/evidence=""""ECO:0000269|PubMed:15284239""""	uniprot_sprot_dat_gz
MP2K2	P36507	P	128	Q	A	(in CFC4; results in increased kinase;activity; dbSNP:rs267607230)"""";/evidence=""""ECO:0000269|PubMed:20358587"""";/id=""""VAR_069782""""	uniprot_sprot_dat_gz
MP2K3	P46734	S	218	E	A	Constitutive activation."""";/evidence=""""ECO:0000269|PubMed:8622669""""	uniprot_sprot_dat_gz
MP2K3	P46734	T	222	E	A	Constitutive activation."""";/evidence=""""ECO:0000269|PubMed:8622669""""	uniprot_sprot_dat_gz
MP2K6	P52564	S	207	E	A	Constitutive activation according to;PubMed:8622669, but not to PubMed:8621675.""""	uniprot_sprot_dat_gz
MP2K6	P52564	T	211	E	A	Constitutive activation according to;PubMed:8622669, but not to PubMed:8621675.""""	uniprot_sprot_dat_gz
MRCKA	Q5VT25	S	222	L	A	Increase in autophosphorylation but not kinase;activity."""";/evidence=""""ECO:0000269|PubMed:11283256""""	uniprot_sprot_dat_gz
NEK2	P51955	T	170	E	A	Kinase activity increased by two fold."""";/evidence=""""ECO:0000269|PubMed:17197699""""	uniprot_sprot_dat_gz
NEK2	P51955	S	171	D	A	Kinase activity increased by two fold."""";/evidence=""""ECO:0000269|PubMed:17197699""""	uniprot_sprot_dat_gz
NEK2	P51955	T	175	E	A	Kinase activity increased by two fold."""";/evidence=""""ECO:0000269|PubMed:17197699""""	uniprot_sprot_dat_gz
NEK6	Q9HC98	Y	108	A	A	Increase in catalytic activity."""";/evidence=""""ECO:0000269|PubMed:19941817""""	uniprot_sprot_dat_gz
NEK7	Q8TDX7	Y	97	A	A	5-fold increase in catalytic activity."""";/evidence=""""ECO:0000269|PubMed:19941817""""	uniprot_sprot_dat_gz
NEK7	Q8TDX7	Y	97	F,	A	L: Moderate increase in catalytic activity."""";/evidence=""""ECO:0000269|PubMed:19941817""""	uniprot_sprot_dat_gz
PAK1	Q13153	T	423	E	A	Constitutive kinase activity."""";/evidence=""""ECO:0000269|PubMed:10551809""""	uniprot_sprot_dat_gz
PAK1	Q13153	Y	429	C	A	(in IDDMSSD; gain-of-function; enhanced PAK1;kinase activity and significantly reduced homodimerization;;dbSNP:rs1565583382)"""";/evidence=""""ECO:0000269|PubMed:30290153"""";/id=""""VAR_081555""""	uniprot_sprot_dat_gz
PAK4	O96013	S	445	N	A	Approximately 30-fold increased;autophosphorylation (constitutively active mutant)."""";/evidence=""""ECO:0000269|PubMed:11313478""""	uniprot_sprot_dat_gz
PDPK1	O15530	A	277	V	A	3-fold increase in kinase activity."""";/evidence=""""ECO:0000269|PubMed:10364160""""	uniprot_sprot_dat_gz
PGFRA	P16234	H	650	Q	A	(in a hypereosinophilic syndrome sample;;constitutively activated kinase)"""";/evidence=""""ECO:0000269|PubMed:21224473"""";/id=""""VAR_066465""""	uniprot_sprot_dat_gz
PGFRA	P16234	N	659	K	A	(in GIST sample; constitutively activated;kinase; dbSNP:rs1057519700)"""";/evidence=""""ECO:0000269|PubMed:15928335"""";/id=""""VAR_066466""""	uniprot_sprot_dat_gz
PGFRA	P16234	N	659	S	A	(in a hypereosinophilic syndrome sample;;constitutively activated kinase)"""";/evidence=""""ECO:0000269|PubMed:21224473"""";/id=""""VAR_066467""""	uniprot_sprot_dat_gz
PGFRA	P16234	D	842	V	A	(in a GIST sample; imatinib resistant,;constitutively activated kinase; dbSNP:rs121908585)"""";/evidence=""""ECO:0000269|PubMed:12522257,;ECO:0000269|PubMed:15928335, ECO:0000269|PubMed:20972453"""";/id=""""VAR_066471""""	uniprot_sprot_dat_gz
PGFRA	P16234	D	842	Y	A	(in a GIST sample; imatinib sensitive,;constitutively activated kinase; dbSNP:rs121913265)"""";/evidence=""""ECO:0000269|PubMed:15928335"""";/id=""""VAR_066472""""	uniprot_sprot_dat_gz
PGFRB	P09619	V	665	A	A	(in PENTT; gain of function in protein;tyrosine kinase activity; shows ligand-independent;constitutive signaling; dbSNP:rs1554108211)"""";/evidence=""""ECO:0000269|PubMed:26279204"""";/id=""""VAR_075866""""	uniprot_sprot_dat_gz
PIM1	P11309	H	68	Y	A	Increased kinase activity."""";/evidence=""""ECO:0000269|PubMed:15808862""""	uniprot_sprot_dat_gz
PLK1	P53350	S	137	D	A	Increases activity. Results in a block in;G1/S."""";/evidence=""""ECO:0000269|PubMed:12207013,;ECO:0000269|PubMed:18615013""""	uniprot_sprot_dat_gz
PLK1	P53350	T	210	D	A	Increases activity and restores recovery after;DNA damage checkpoint."""";/evidence=""""ECO:0000269|PubMed:12207013,;ECO:0000269|PubMed:12447691, ECO:0000269|PubMed:17461553,;ECO:0000269|PubMed:18615013, ECO:0000269|PubMed:19160488""""	uniprot_sprot_dat_gz
PLK4	O00444	T	170	D	A	Activating mutant."""";/evidence=""""ECO:0000269|PubMed:18239451,;ECO:0000269|PubMed:19164942""""	uniprot_sprot_dat_gz
PRKX	P51817	H	93	Q	A	Constitutive kinase activity; when associated;with R-202."""";/evidence=""""ECO:0000269|PubMed:16236808""""	uniprot_sprot_dat_gz
PRKX	P51817	W	202	R	A	Constitutive kinase activity; when associated;with Q-93."""";/evidence=""""ECO:0000269|PubMed:16236808""""	uniprot_sprot_dat_gz
RAF1	P04049	T	491	D	A	Increased kinase activity but can still be;inhibited by PPP5C; when associated with D-494."""";/evidence=""""ECO:0000269|PubMed:16892053""""	uniprot_sprot_dat_gz
ROR2	Q01974	D	482	G	A	Slight increase in kinase activity."""";/evidence=""""ECO:0000269|PubMed:25029443""""	uniprot_sprot_dat_gz
RYK	P34925	N	484	F	A	Gain of an autophosphorylation activity. Gain;of an autophosphorylation activity; when associated with A-;359. Gain of an autophosphorylation activity; when;associated with G-334 and G-482."""";/evidence=""""ECO:0000269|PubMed:10454588""""	uniprot_sprot_dat_gz
RYK	P34925	A	485	G	A	Gain of an autophosphorylation activity. Gain;of an autophosphorylation activity; when associated with G-;334 and F-481."""";/evidence=""""ECO:0000269|PubMed:10454588""""	uniprot_sprot_dat_gz
SIK2	Q9H0K1	T	175	E	A	Constitutively active."""";/evidence=""""ECO:0000269|PubMed:14976552""""	uniprot_sprot_dat_gz
SRC	P12931	P	302	E	A	Kinase active. Interacts with PDLIM4; when;associated with E-307 and F-419."""";/evidence=""""ECO:0000269|PubMed:19307596""""	uniprot_sprot_dat_gz
SRC	P12931	P	307	E	A	Kinase active. Interacts with PDLIM4; when;associated with E-302 and F-419."""";/evidence=""""ECO:0000269|PubMed:19307596""""	uniprot_sprot_dat_gz
TIE2	Q02763	Y	897	C	A	(in VMCM; increased ligand-independent;autophosphorylation and kinase activation;;dbSNP:rs80338909)"""";/evidence=""""ECO:0000269|PubMed:19888299"""";/id=""""VAR_066606""""	uniprot_sprot_dat_gz
