uniprot_name	uniprot_id	Orig_AA	Position	Mut_AA	type	info	comes_from
TIE2	Q02763	Y	897	S	A	(in VMCM; also found in a patient with;solitary sporadic venous malformations; increased ligand-;independent autophosphorylation and kinase activation;;dbSNP:rs80338909)"""";/evidence=""""ECO:0000269|PubMed:10369874,;ECO:0000269|PubMed:19079259, ECO:0000269|PubMed:19888299"""";/id=""""VAR_008716""""	uniprot_sprot_dat_gz
TIE2	Q02763	R	915	H	A	(in VMCM; strongly increased ligand-;independent autophosphorylation and kinase activation;;dbSNP:rs387906745)"""";/evidence=""""ECO:0000269|PubMed:19888299"""";/id=""""VAR_066607""""	uniprot_sprot_dat_gz
TSSK1	Q9BXA7	T	174	E	A	Constitutively active."""";/evidence=""""ECO:0000269|PubMed:15733851""""	uniprot_sprot_dat_gz
VGFR1	P17948	N	1050	D	A	Strongly increases kinase activity. Increases;activity in promoting proliferation of endothelial cells."""";/evidence=""""ECO:0000269|PubMed:16286478""""	uniprot_sprot_dat_gz
VGFR2	P35968	C	1045	A	A	Significantly higher kinase activity."""";/evidence=""""ECO:0000269|PubMed:23199280""""	uniprot_sprot_dat_gz
ZAP70	P43403	K	362	E	A	Increases constitutive kinase activity on LAT;phosphorylation, strongly increases subcellular;localization of CD69 at the cell surface and decreases;autoinhibition conformation."""";/evidence=""""ECO:0000269|PubMed:26783323""""	uniprot_sprot_dat_gz
AKT1	P31749	K	179	M	D	Abolished serine/threonine-protein kinase;activity."""";/evidence=""""ECO:0000269|PubMed:33594058""""	uniprot_sprot_dat_gz
AURKA	O14965	G	198	N	D	Reduces interaction with TPX2. Reduces kinase;activity tenfold. Promotes interaction with the AURKB;binding partners INCENP and BIRC5 that are normally not;bound by AURKA."""";/evidence=""""ECO:0000269|PubMed:19357306""""	uniprot_sprot_dat_gz
AURKA	O14965	D	274	N	D	Abolishes cilia disassembly and kinase;activity."""";/evidence=""""ECO:0000269|PubMed:14580337,;ECO:0000269|PubMed:17604723""""	uniprot_sprot_dat_gz
AURKA	O14965	T	288	A	D	Reduces cilia disassembly and kinase;activity."""";/evidence=""""ECO:0000269|PubMed:17604723""""	uniprot_sprot_dat_gz
AURKB	Q96GD4	K	106	R	D	Leads to loss of kinase activity and severely;impairs mitotic progression."""";/evidence=""""ECO:0000269|PubMed:12686604,;ECO:0000269|PubMed:12925766, ECO:0000269|PubMed:14722118,;ECO:0000269|PubMed:16179162""""	uniprot_sprot_dat_gz
AURKC	Q9UQB9	K	72	R	D	Impairs kinase activity."""";/evidence=""""ECO:0000269|PubMed:15316025,;ECO:0000269|PubMed:15499654""""	uniprot_sprot_dat_gz
AURKC	Q9UQB9	D	166	Y	D	Impairs kinase activity, and keeps AURKC with;the chromosomes until the end of mitosis."""";/evidence=""""ECO:0000269|PubMed:15938719""""	uniprot_sprot_dat_gz
AURKC	Q9UQB9	T	198	A	D	Impairs kinase activity."""";/evidence=""""ECO:0000269|PubMed:15316025,;ECO:0000269|PubMed:15670791""""	uniprot_sprot_dat_gz
BRAF	P15056	K	483	S	D	Reduces kinase activity with MAP2K1."""";/evidence=""""ECO:0000269|PubMed:21441910""""	uniprot_sprot_dat_gz
BRSK1	Q8TDC3	T	189	A	D	Prevents phosphorylation and activation by;STK11/LKB1 complex."""";/evidence=""""ECO:0000269|PubMed:14976552""""	uniprot_sprot_dat_gz
BRSK2	Q8IWQ3	T	174	A	D	Prevents phosphorylation and activation by;STK11/LKB1 complex."""";/evidence=""""ECO:0000269|PubMed:14976552,;ECO:0000269|PubMed:18339622, ECO:0000269|PubMed:22798068""""	uniprot_sprot_dat_gz
BTK	Q06187	R	520	Q	D	(in XLA; severe; prevents activation due to;absence of contact between the catalytic loop and the;regulatory phosphorylated residue; dbSNP:rs128621202)"""";/evidence=""""ECO:0000269|PubMed:7633429,;ECO:0000269|PubMed:7809124, ECO:0000269|PubMed:7849697,;ECO:0000269|PubMed:7880320"""";/id=""""VAR_006251""""	uniprot_sprot_dat_gz
CDK12	Q9NYV4	D	877	N	D	Abolishes kinase activity."""";/evidence=""""ECO:0000269|PubMed:24662513""""	uniprot_sprot_dat_gz
CDK14	O94921	K	164	R	D	Abolishes protein kinase activity."""";/evidence=""""ECO:0000269|PubMed:17517622,;ECO:0000269|PubMed:19524571""""	uniprot_sprot_dat_gz
CDK16	Q00536	K	194	A	D	Loss of kinase activity. Abolishes effect on;insulin secretion."""";/evidence=""""ECO:0000269|PubMed:22184064,;ECO:0000269|PubMed:22798068""""	uniprot_sprot_dat_gz
CDK19	Q9BWU1	G	28	R	D	(in DEE87; decreased protein kinase;activity)"""";/evidence=""""ECO:0000269|PubMed:33495529"""";/id=""""VAR_084393""""	uniprot_sprot_dat_gz
CDK20	Q8IZL9	T	161	A	D	Impairs CDK2 T-160 phosphorylation and;activity."""";/evidence=""""ECO:0000269|PubMed:14597612""""	uniprot_sprot_dat_gz
CDK2	P24941	T	160	A	D	Abolishes activity."""";/evidence=""""ECO:0000269|PubMed:1396589""""	uniprot_sprot_dat_gz
CDK2	P24941	L	166	R	D	Reduced phosphorylation by CAK and reduced;kinase activity."""";/evidence=""""ECO:0000269|PubMed:17373709""""	uniprot_sprot_dat_gz
CDK8	P49336	V	27	L	D	(in IDDHBA; decreased protein kinase;activity)"""";/evidence=""""ECO:0000269|PubMed:30905399"""";/id=""""VAR_083786""""	uniprot_sprot_dat_gz
CDK8	P49336	R	29	G	D	(in IDDHBA; decreased protein kinase;activity; dbSNP:rs1593218885)"""";/evidence=""""ECO:0000269|PubMed:30905399"""";/id=""""VAR_083787""""	uniprot_sprot_dat_gz
CDK8	P49336	G	30	S	D	(in IDDHBA; decreased protein kinase;activity; dbSNP:rs1593218890)"""";/evidence=""""ECO:0000269|PubMed:30905399"""";/id=""""VAR_083788""""	uniprot_sprot_dat_gz
CDK8	P49336	S	62	L	D	(in IDDHBA; decreased protein kinase;activity; dbSNP:rs1565977796)"""";/evidence=""""ECO:0000269|PubMed:30905399"""";/id=""""VAR_083789""""	uniprot_sprot_dat_gz
CDK8	P49336	R	178	Q	D	(in IDDHBA; decreased protein kinase;activity; dbSNP:rs1418353379)"""";/evidence=""""ECO:0000269|PubMed:30905399"""";/id=""""VAR_083791""""	uniprot_sprot_dat_gz
CDK8	P49336	V	193	G	D	(in IDDHBA; decreased protein kinase;activity)"""";/evidence=""""ECO:0000269|PubMed:30905399"""";/id=""""VAR_083792""""	uniprot_sprot_dat_gz
CDK8	P49336	I	223	M	D	(in IDDHBA; decreased protein kinase;activity; dbSNP:rs1593310364)"""";/evidence=""""ECO:0000269|PubMed:30905399"""";/id=""""VAR_083793""""	uniprot_sprot_dat_gz
CDK9	P50750	K	44	R	D	Impaired kinase and transcriptional elongation;activities, but normal cyclin T1 and HEXIM1 binding."""";/evidence=""""ECO:0000269|PubMed:17452463""""	uniprot_sprot_dat_gz
CDK9	P50750	K	48	Q	D	Mimics acetylation; leading to impaired;protein kinase activity."""";/evidence=""""ECO:0000269|PubMed:28426094""""	uniprot_sprot_dat_gz
CHK1	O14757	K	38	R	D	Abolishes kinase activity."""";/evidence=""""ECO:0000269|PubMed:12446774,;ECO:0000269|PubMed:14681223""""	uniprot_sprot_dat_gz
CHK1	O14757	D	130	A	D	Abolishes kinase activity."""";/evidence=""""ECO:0000269|PubMed:10673501,;ECO:0000269|PubMed:11390642, ECO:0000269|PubMed:11535615,;ECO:0000269|PubMed:11821419, ECO:0000269|PubMed:12588868,;ECO:0000269|PubMed:14681206, ECO:0000269|PubMed:15311285,;ECO:0000269|PubMed:9278511""""	uniprot_sprot_dat_gz
CHK2	O96017	D	368	N	D	Loss of autophosphorylation activity."""";/evidence=""""ECO:0000269|PubMed:15342622""""	uniprot_sprot_dat_gz
CHK2	O96017	H	371	Y	D	(confers a moderate risk of breast cancer;;partially reduces kinase activity; dbSNP:rs531398630)"""";/evidence=""""ECO:0000269|PubMed:21618645"""";/id=""""VAR_066012""""	uniprot_sprot_dat_gz
CILK1	Q9UPZ9	T	157	A	D	Reduction of activity and loss of;autophosphorylation. Loss of activity and;autophosphorylation; when associated with F-159."""";/evidence=""""ECO:0000269|PubMed:10699974""""	uniprot_sprot_dat_gz
CILK1	Q9UPZ9	Y	159	F	D	Reduction of activity and loss of;autophosphorylation. Loss of activity and;autophosphorylation; when associated with A-157."""";/evidence=""""ECO:0000269|PubMed:10699974""""	uniprot_sprot_dat_gz
CILK1	Q9UPZ9	R	272	Q	D	(in ECO; significantly impairs kinase;activity; decreased localization at the ciliary tips;;impaired ciliogenesis; results in abnormally elongated;cilia; impairs mitosis, cell-cycle exit and radial;neuroblast migration, while promoting apoptosis, when;tested in a heterologous system; loss of nuclear;localization; dbSNP:rs118203918)"""";/evidence=""""ECO:0000269|PubMed:19185282,;ECO:0000269|PubMed:24797473, ECO:0000269|PubMed:24853502,;ECO:0000269|PubMed:29539279"""";/id=""""VAR_057994""""	uniprot_sprot_dat_gz
CSK	P41240	Y	304	F	D	Decreases activity by two-thirds and alters;conformation."""";/evidence=""""ECO:0000269|PubMed:9148770""""	uniprot_sprot_dat_gz
CTRO	O14578	G	106	V	D	(in MCPH17; impairs kinase activity; exhibits;abnormal mitotic cytokinesis; exhibits multipolar spindles;;increases the neurons apoptotic process;;dbSNP:rs886037892)"""";/evidence=""""ECO:0000269|PubMed:27453578"""";/id=""""VAR_077442""""	uniprot_sprot_dat_gz
CTRO	O14578	K	126	Q	D	(in MCPH17; impairs kinase activity; exhibits;abnormal mitotic cytokinesis; exhibits multipolar spindles;;increases the neurons apoptotic process;;dbSNP:rs886037893)"""";/evidence=""""ECO:0000269|PubMed:27453578"""";/id=""""VAR_077443""""	uniprot_sprot_dat_gz
CTRO	O14578	D	230	V	D	(in MCPH17; impairs kinase activity; exhibits;abnormal mitotic cytokinesis; exhibits multipolar spindles;;increases the neurons apoptotic process;;dbSNP:rs886037894)"""";/evidence=""""ECO:0000269|PubMed:27453578"""";/id=""""VAR_077444""""	uniprot_sprot_dat_gz
DAPK3	O43293	K	42	A	D	Loss of kinase activity at low concentrations;of ATP."""";/evidence=""""ECO:0000269|PubMed:17158456""""	uniprot_sprot_dat_gz
DAPK3	O43293	T	112	M	D	(in a colorectal adenocarcinoma sample;;somatic mutation; greatly reduces kinase activity,;increases cell proliferation and cell survival)"""";/evidence=""""ECO:0000269|PubMed:17344846,;ECO:0000269|PubMed:21487036"""";/id=""""VAR_040438""""	uniprot_sprot_dat_gz
DAPK3	O43293	D	161	N	D	(in an ovarian mucinous carcinoma sample;;somatic mutation; greatly reduces kinase activity,;increases cell proliferation and cell survival)"""";/evidence=""""ECO:0000269|PubMed:17344846,;ECO:0000269|PubMed:21487036"""";/id=""""VAR_040439""""	uniprot_sprot_dat_gz
DAPK3	O43293	T	180	A	D	Greatly reduced kinase activity."""";/evidence=""""ECO:0000269|PubMed:21487036""""	uniprot_sprot_dat_gz
DAPK3	O43293	P	216	S	D	(in a lung neuroendocrine carcinoma sample;;somatic mutation; greatly reduces kinase activity,;increases cell proliferation, cell adhesion and cell;survival)"""";/evidence=""""ECO:0000269|PubMed:17344846,;ECO:0000269|PubMed:21487036"""";/id=""""VAR_040440""""	uniprot_sprot_dat_gz
DAPK3	O43293	T	265	A	D	Loss of phosphorylation by ROCK1,;catalytically inactive."""";/evidence=""""ECO:0000269|PubMed:17158456""""	uniprot_sprot_dat_gz
DDR2	Q16832	K	608	A	D	Abolishes kinase activity."""";/evidence=""""ECO:0000269|PubMed:16186108""""	uniprot_sprot_dat_gz
DYR1A	Q13627	K	188	R	D	Abolished protein kinase activity."""";/evidence=""""ECO:0000269|PubMed:23665168,;ECO:0000269|PubMed:25620562""""	uniprot_sprot_dat_gz
DYR1A	Q13627	Y	321	F	D	Mildly reduces kinase activity. Does not;abolish autophosphorylation on tyrosine residues."""";/evidence=""""ECO:0000269|PubMed:23665168""""	uniprot_sprot_dat_gz
DYR1B	Q9Y463	K	140	R	D	Abolishes kinase activity."""";/evidence=""""ECO:0000269|PubMed:10910078""""	uniprot_sprot_dat_gz
DYR1B	Q9Y463	D	239	A	D	Abolishes kinase activity."""";/evidence=""""ECO:0000269|PubMed:32611815""""	uniprot_sprot_dat_gz
DYR1B	Q9Y463	Y	271	F	D	Abolishes kinase activity; when associated;with F-273."""";/evidence=""""ECO:0000269|PubMed:10910078""""	uniprot_sprot_dat_gz
DYRK2	Q92630	K	251	R	D	Abolishes protein serine/threonine kinase;activity."""";/evidence=""""ECO:0000269|PubMed:23362280""""	uniprot_sprot_dat_gz
DYRK4	Q9NR20	Y	264	F	D	Abolishes kinase activity."""";/evidence=""""ECO:0000269|PubMed:21127067""""	uniprot_sprot_dat_gz
E2AK2	P19525	T	446	A	D	Significant loss of activity and impairs;autophosphorylation of T-451."""";/evidence=""""ECO:0000269|PubMed:11337501""""	uniprot_sprot_dat_gz
EGFR	P00533	K	745	A,	D	M: Abolishes kinase activity."""";/evidence=""""ECO:0000269|PubMed:19560417""""	uniprot_sprot_dat_gz
ERBB4	Q15303	K	751	R	D	Abolishes kinase activity. Abolishes;phosphorylation, proteolytic processing and nuclear;localization."""";/evidence=""""ECO:0000269|PubMed:11390655,;ECO:0000269|PubMed:17486069, ECO:0000269|PubMed:17638867""""	uniprot_sprot_dat_gz
ERN1	O75460	K	599	A	D	Loss of autophosphorylation and of;endoribonuclease activity. Inhibition of growth arrest."""";/evidence=""""ECO:0000269|PubMed:11175748,;ECO:0000269|PubMed:9637683""""	uniprot_sprot_dat_gz
FAK2	Q14289	K	457	A	D	Abolishes kinase activity."""";/evidence=""""ECO:0000269|PubMed:15166227""""	uniprot_sprot_dat_gz
FER	P16591	K	591	R	D	Abolishes kinase activity."""";/evidence=""""ECO:0000269|PubMed:9722593""""	uniprot_sprot_dat_gz
FES	P07332	K	590	E	D	Abolishes kinase activity. Fails to inhibit;proliferation of melanoma cells."""";/evidence=""""ECO:0000269|PubMed:15485904,;ECO:0000269|PubMed:28463229""""	uniprot_sprot_dat_gz
FES	P07332	M	704	V	D	Reduced autophosphorylation and strongly;reduced kinase activity."""";/evidence=""""ECO:0000269|PubMed:15867340,;ECO:0000269|PubMed:16455651""""	uniprot_sprot_dat_gz
FES	P07332	Y	713	F	D	Reduces kinase activity by over 90%."""";/evidence=""""ECO:0000269|PubMed:7687763""""	uniprot_sprot_dat_gz
FES	P07332	V	743	M	D	Strongly reduced autophosphorylation and;kinase activity."""";/evidence=""""ECO:0000269|PubMed:15867340,;ECO:0000269|PubMed:16455651""""	uniprot_sprot_dat_gz
FES	P07332	S	759	F	D	Reduced autophosphorylation and strongly;reduced kinase activity."""";/evidence=""""ECO:0000269|PubMed:15867340,;ECO:0000269|PubMed:16455651""""	uniprot_sprot_dat_gz
FGFR1	P11362	K	618	N	D	(in HH2; some patients also carry GNRHR;mutations; impairs tyrosine kinase activity)"""";/evidence=""""ECO:0000269|PubMed:19820032,;ECO:0000269|PubMed:23643382"""";/id=""""VAR_069293""""	uniprot_sprot_dat_gz
FGFR1	P11362	P	722	H	D	(in HH2; associated with K-724; also found in;a family member with isolated anosmia; reduced tyrosine;kinase activity; dbSNP:rs267606805)"""";/evidence=""""ECO:0000269|PubMed:16606836,;ECO:0000269|PubMed:23643382"""";/id=""""VAR_031005""""	uniprot_sprot_dat_gz
FGFR1	P11362	N	724	K	D	(in HH2; associated with H-722; also found in;a family member with isolated anosmia; reduced tyrosine;kinase activity; dbSNP:rs267606806)"""";/evidence=""""ECO:0000269|PubMed:16606836,;ECO:0000269|PubMed:23643382"""";/id=""""VAR_031007""""	uniprot_sprot_dat_gz
FGFR2	P21802	A	628	T	D	(in LADDS; strongly reduced kinase activity;;dbSNP:rs121918509)"""";/evidence=""""ECO:0000269|PubMed:16501574"""";/id=""""VAR_029884""""	uniprot_sprot_dat_gz
FGFR3	P22607	K	508	A	D	Loss of kinase activity. Abolishes;ubiquitination."""";/evidence=""""ECO:0000269|PubMed:12297284,;ECO:0000269|PubMed:16410555""""	uniprot_sprot_dat_gz
FGFR3	P22607	Y	724	F	D	Strongly reduced kinase activity. Strongly;reduced mitogen activity."""";/evidence=""""ECO:0000269|PubMed:11294897""""	uniprot_sprot_dat_gz
FLT3	P36888	K	644	A	D	Abolishes kinase activity."""";/evidence=""""ECO:0000269|PubMed:15831474""""	uniprot_sprot_dat_gz
HCK	P08631	Y	411	A	D	Reduced catalytic activity and higher affinity;for target peptides."""";/evidence=""""ECO:0000269|PubMed:10644735""""	uniprot_sprot_dat_gz
HIPK1	Q86Z02	D	315	N	D	Loss of kinase activity and impaired MAP3K5-;JNK inactivation."""";/evidence=""""ECO:0000269|PubMed:15701637""""	uniprot_sprot_dat_gz
HIPK3	Q9H422	K	226	R	D	Loss of kinase activity and impaired;activation of SF1."""";/evidence=""""ECO:0000269|PubMed:17210646""""	uniprot_sprot_dat_gz
IGF1R	P08069	K	1033	A	D	Kinase inactive. Abolishes tyrosine;phosphorylation and abolishes interaction with IRS1, SHC1;and PIK3R1."""";/evidence=""""ECO:0000269|PubMed:7541045""""	uniprot_sprot_dat_gz
IKKA	O15111	T	23	A	D	Loss of phosphorylation and decrease of kinase;activity."""";/evidence=""""ECO:0000269|PubMed:10485710""""	uniprot_sprot_dat_gz
IKKB	O14920	S	177	A	D	Decrease of activity."""";/evidence=""""ECO:0000269|PubMed:19675099,;ECO:0000269|PubMed:9346484""""	uniprot_sprot_dat_gz
IKKB	O14920	S	181	A	D	Decrease of activity."""";/evidence=""""ECO:0000269|PubMed:19675099,;ECO:0000269|PubMed:9346484""""	uniprot_sprot_dat_gz
IKKE	Q14164	E	168	A	D	Slight decrease of kinase activity."""";/evidence=""""ECO:0000269|PubMed:10421793""""	uniprot_sprot_dat_gz
IKKE	Q14164	S	172	A	D	Loss of autophosphorylation and of kinase;activity."""";/evidence=""""ECO:0000269|PubMed:10421793""""	uniprot_sprot_dat_gz
IKKE	Q14164	S	172	E	D	Decrease in kinase activity."""";/evidence=""""ECO:0000269|PubMed:10421793""""	uniprot_sprot_dat_gz
ILK	Q13418	E	359	K	D	Inactivation of ILK."""";/evidence=""""ECO:0000269|PubMed:9736715""""	uniprot_sprot_dat_gz
INSR	P06213	K	1057	A	D	Abolishes the kinase activity and abolishes;interaction with IRS1, SHC1, GRB7 and PIK3R1."""";/evidence=""""ECO:0000269|PubMed:10803466,;ECO:0000269|PubMed:3101064, ECO:0000269|PubMed:7537849""""	uniprot_sprot_dat_gz
INSR	P06213	K	1057	M,	D	R: Abolishes the kinase activity."""";/evidence=""""ECO:0000269|PubMed:10803466,;ECO:0000269|PubMed:3101064, ECO:0000269|PubMed:7537849""""	uniprot_sprot_dat_gz
INSR	P06213	E	1206	D	D	(in IRAN type A; accelerates degradation of;the protein and impairs kinase activity)"""";/evidence=""""ECO:0000269|PubMed:7983039"""";/id=""""VAR_015931""""	uniprot_sprot_dat_gz
INSR	P06213	W	1220	L	D	(in IRAN type A; accelerates degradation of;the protein and impairs kinase activity; dbSNP:rs52800171)"""";/evidence=""""ECO:0000269|PubMed:7983039,;ECO:0000269|PubMed:8390949"""";/id=""""VAR_004100""""	uniprot_sprot_dat_gz
KAPCG	P22612	I	74	M	D	(in BDPLT19; patient platelets show impaired;activation; dbSNP:rs724159972)"""";/evidence=""""ECO:0000269|PubMed:25061177"""";/id=""""VAR_072672""""	uniprot_sprot_dat_gz
KC1D	P48730	K	38	M	D	Impaired kinase activity and abnormal;subcellular localization with exclusive accumulation to the;nucleus."""";/evidence=""""ECO:0000269|PubMed:11161704""""	uniprot_sprot_dat_gz
KC1D	P48730	T	44	A	D	(in FASPS2; strongly reduces kinase activity;;dbSNP:rs104894561)"""";/evidence=""""ECO:0000269|PubMed:15800623,;ECO:0000269|PubMed:23636092"""";/id=""""VAR_029075""""	uniprot_sprot_dat_gz
KC1D	P48730	H	46	R	D	(in FASPS2; strongly reduces kinase activity;;dbSNP:rs397514693)"""";/evidence=""""ECO:0000269|PubMed:23636092"""";/id=""""VAR_069801""""	uniprot_sprot_dat_gz
KC1D	P48730	T	176	I	D	Impaired kinase activity and abnormal;subcellular localization with exclusive accumulation to the;nucleus."""";/evidence=""""ECO:0000269|PubMed:11161704""""	uniprot_sprot_dat_gz
KCC1A	Q14012	K	49	A	D	Catalytically inactive form; prevents CDK4;activation."""";/evidence=""""ECO:0000269|PubMed:14754892,;ECO:0000269|PubMed:7641687""""	uniprot_sprot_dat_gz
KCC1D	Q8IU85	K	52	A	D	Catalytically inactive form."""";/evidence=""""ECO:0000269|PubMed:16324104""""	uniprot_sprot_dat_gz
KPCA	P17252	T	497	A	D	Abolishes phosphorylation and catalytic;activity; when associated with A-494 and A-495."""";/evidence=""""ECO:0000269|PubMed:8349635""""	uniprot_sprot_dat_gz
KPCE	Q02156	K	437	W	D	Abolishes activity and S-729 phosphorylation."""";/evidence=""""ECO:0000269|PubMed:11964154""""	uniprot_sprot_dat_gz
KPCI	P41743	K	274	W	D	Abolishes activity."""";/evidence=""""ECO:0000269|PubMed:10906326""""	uniprot_sprot_dat_gz
KS6A5	O75582	S	212	A	D	Inactivates the N-terminal kinase domain."""";/evidence=""""ECO:0000269|PubMed:15568999""""	uniprot_sprot_dat_gz
KS6B1	P23443	K	167	N	D	Greatly reduces activity. Greatly reduces;phosphorylation at T-412 and moderately reduces;phosphorylation at T-252."""";/evidence=""""ECO:0000269|PubMed:17446865""""	uniprot_sprot_dat_gz
LATS2	Q9NRM7	K	697	A	D	Loss of kinase activity, autophosphorylation;and tumor suppressor activity."""";/evidence=""""ECO:0000269|PubMed:10871863,;ECO:0000269|PubMed:12853976""""	uniprot_sprot_dat_gz
LATS2	Q9NRM7	S	872	A	D	Loss of tumor suppressor activity."""";/evidence=""""ECO:0000269|PubMed:12853976""""	uniprot_sprot_dat_gz
LIMK1	P53667	T	508	A	D	Abolishes activation by ROCK1."""";/evidence=""""ECO:0000269|PubMed:10196227,;ECO:0000269|PubMed:10652353""""	uniprot_sprot_dat_gz
LIMK1	P53667	T	508	V	D	Reduces kinase activity."""";/evidence=""""ECO:0000269|PubMed:10196227,;ECO:0000269|PubMed:10652353""""	uniprot_sprot_dat_gz
LRRK2	Q5S007	K	1906	A	D	Loss of kinase activity. Decreases proteosomal;degradation of MAPT; when associated with N-1994 and A-;2017."""";/evidence=""""ECO:0000269|PubMed:26014385""""	uniprot_sprot_dat_gz
LRRK2	Q5S007	D	1994	N	D	Loss of kinase activity. No loss of;interaction with SEC16A and no loss of ability to recruit;SEC16A to endoplasmic reticulum exit sites. Decreases;proteosomal degradation of MAPT; when associated with A-;1906 and A-2017."""";/evidence=""""ECO:0000269|PubMed:25201882,;ECO:0000269|PubMed:26014385, ECO:0000269|PubMed:26824392""""	uniprot_sprot_dat_gz
LRRK2	Q5S007	D	2017	A	D	Loss of kinase activity. Decreases proteosomal;degradation of MAPT; when associated with A-1906 and N-;1994. Loss of phosphorylation of RAB10; when associated;with G-1441, C-1699, or S-2019."""";/evidence=""""ECO:0000269|PubMed:26014385,;ECO:0000269|PubMed:29125462, ECO:0000269|PubMed:29212815,;ECO:0000269|PubMed:30635421""""	uniprot_sprot_dat_gz
LTK	P29376	Y	753	F	D	Abolishes interaction with PI3-kinase subunit;p85, impairs PI3 kinase activity and leads to apoptosis;(demonstrated with chimeric EGFR-LTK)."""";/evidence=""""ECO:0000269|PubMed:9223670""""	uniprot_sprot_dat_gz
LYN	P07948	Y	397	F	D	Strongly reduced kinase activity."""";/evidence=""""ECO:0000269|PubMed:16920712""""	uniprot_sprot_dat_gz
M3K11	Q16584	K	144	A	D	Greatly reduced autophosphorylation activity."""";/evidence=""""ECO:0000269|PubMed:11053428,;ECO:0000269|PubMed:8195146""""	uniprot_sprot_dat_gz
M3K11	Q16584	K	144	R	D	Loss of kinase activity. Prevents activation;of SAPK and MAPK14."""";/evidence=""""ECO:0000269|PubMed:11053428,;ECO:0000269|PubMed:8195146""""	uniprot_sprot_dat_gz
M3K11	Q16584	E	164	A	D	Greatly reduced autophosphorylation activity."""";/evidence=""""ECO:0000269|PubMed:8195146""""	uniprot_sprot_dat_gz
M3K11	Q16584	T	277	A	D	Severely reduced autophosphorylation activity.;Prevents phosphorylation of SAPK and MAPK14."""";/evidence=""""ECO:0000269|PubMed:11053428""""	uniprot_sprot_dat_gz
M3K11	Q16584	S	281	A	D	Reduced autophosphorylation activity. Reduced;activation of SAPK and MAPK14."""";/evidence=""""ECO:0000269|PubMed:11053428""""	uniprot_sprot_dat_gz
M3K13	O43283	K	195	A	D	Kinase inactive. Fails to activate NF-kappa-;B."""";/evidence=""""ECO:0000269|PubMed:12492477""""	uniprot_sprot_dat_gz
M3K20	Q9NYL2	T	161	A	D	Loss of autophosphorylation activity."""";/evidence=""""ECO:0000269|PubMed:15342622""""	uniprot_sprot_dat_gz
M3K20	Q9NYL2	T	162	A	D	Slight loss of autophosphorylation activity."""";/evidence=""""ECO:0000269|PubMed:15342622""""	uniprot_sprot_dat_gz
M3K20	Q9NYL2	S	165	A	D	Loss of autophosphorylation activity."""";/evidence=""""ECO:0000269|PubMed:15342622""""	uniprot_sprot_dat_gz
M3K5	Q99683	K	709	R	D	Loss of kinase activity. Abolishes DAXX-;mediated apoptosis. Loss of RC3H2-mediated ubiquitination."""";/evidence=""""ECO:0000269|PubMed:17210579,;ECO:0000269|PubMed:24448648, ECO:0000269|PubMed:9743501""""	uniprot_sprot_dat_gz
M3K9	P80192	T	304	A	D	Reduces threonine phosphorylation. Impairs JNK;activation."""";/evidence=""""ECO:0000269|PubMed:15610029""""	uniprot_sprot_dat_gz
M3K9	P80192	T	305	A	D	Little effect on threonine phosphorylation.;Mildly impairs JNK activation."""";/evidence=""""ECO:0000269|PubMed:15610029""""	uniprot_sprot_dat_gz
M3K9	P80192	S	308	A	D	Impairs JNK activation."""";/evidence=""""ECO:0000269|PubMed:15610029""""	uniprot_sprot_dat_gz
M3K9	P80192	T	312	A	D	Loss of threonine phosphorylation. Strongly;impairs JNK activation."""";/evidence=""""ECO:0000269|PubMed:15610029""""	uniprot_sprot_dat_gz
MAK	P20794	T	157	A	D	Abolishes autophosphorylation and impairs;kinase activity."""";/evidence=""""ECO:0000269|PubMed:21986944""""	uniprot_sprot_dat_gz
MAPK2	P49137	K	93	R	D	Kinase defective mutant, abolishes activity."""";/evidence=""""ECO:0000269|PubMed:14517288""""	uniprot_sprot_dat_gz
MAPK2	P49137	D	207	A	D	Kinase defective mutant, abolishes activity."""";/evidence=""""ECO:0000269|PubMed:8846784""""	uniprot_sprot_dat_gz
MAPK2	P49137	T	222	A	D	Strong decrease in kinase activity."""";/evidence=""""ECO:0000269|PubMed:14517288,;ECO:0000269|PubMed:15014438, ECO:0000269|PubMed:8846784""""	uniprot_sprot_dat_gz
MAPK2	P49137	S	272	A	D	Strong decrease in kinase activity."""";/evidence=""""ECO:0000269|PubMed:8846784""""	uniprot_sprot_dat_gz
MAPK5	Q8IW41	K	51	M	D	Kinase defective mutant, abolishes activity."""";/evidence=""""ECO:0000269|PubMed:12808055""""	uniprot_sprot_dat_gz
MARK1	Q9P0L2	T	215	A	D	Prevents phosphorylation and activation by;STK11/LKB1 complex."""";/evidence=""""ECO:0000269|PubMed:14976552""""	uniprot_sprot_dat_gz
MARK2	Q7KZI7	T	208	A	D	Prevents phosphorylation and activation by;STK11/LKB1 complex."""";/evidence=""""ECO:0000269|PubMed:14976552""""	uniprot_sprot_dat_gz
MARK3	P27448	T	211	A	D	Prevents phosphorylation and activation by;STK11/LKB1 complex."""";/evidence=""""ECO:0000269|PubMed:14976552""""	uniprot_sprot_dat_gz
MARK4	Q96L34	T	214	A	D	Prevents phosphorylation and activation by;STK11/LKB1 complex."""";/evidence=""""ECO:0000269|PubMed:14976552""""	uniprot_sprot_dat_gz
MARK4	Q96L34	T	214	E	D	Mimicks phosphorylation state, leading to;increased activity. Decreases mTORC1 activity."""";/evidence=""""ECO:0000269|PubMed:14976552,;ECO:0000269|PubMed:23184942""""	uniprot_sprot_dat_gz
MELK	Q14680	D	150	A	D	Abolishes enzymatic activity."""";/evidence=""""ECO:0000269|PubMed:14699119,;ECO:0000269|PubMed:16216881, ECO:0000269|PubMed:17280616""""	uniprot_sprot_dat_gz
MELK	Q14680	T	167	A	D	Abolishes activation of serine/threonine-;protein kinase activity and has only weak activity."""";/evidence=""""ECO:0000269|PubMed:14976552""""	uniprot_sprot_dat_gz
MELK	Q14680	S	171	A	D	Abolishes activation of serine/threonine-;protein kinase activity and has only weak activity."""";/evidence=""""ECO:0000269|PubMed:16216881""""	uniprot_sprot_dat_gz
MELK	Q14680	S	171	D	D	Inactive."""";/evidence=""""ECO:0000269|PubMed:16216881""""	uniprot_sprot_dat_gz
